{
  "$schema": "https://json-schema.org/draft/2020-12/schema",
  "$id": "https://github.com/fullsys/claude-plugin-marketplace/schema/plugin.schema.json",
  "title": "Plugin Metadata",
  "description": "JSON Schema pro validaci plugin.json v Claude Plugin Marketplace",
  "type": "object",
  "required": [
    "id",
    "name",
    "version",
    "description",
    "author",
    "license",
    "types"
  ],
  "additionalProperties": false,
  "properties": {
    "$schema": {
      "type": "string"
    },
    "id": {
      "type": "string",
      "pattern": "^[a-z0-9-]+$",
      "description": "Unikátní identifikátor pluginu (lowercase, pomlčky, bez mezer)"
    },
    "name": {
      "type": "string",
      "minLength": 1
    },
    "version": {
      "type": "string",
      "pattern": "^(0|[1-9]\\d*)\\.(0|[1-9]\\d*)\\.(0|[1-9]\\d*)(?:-[0-9A-Za-z-]+(?:\\.[0-9A-Za-z-]+)*)?(?:\\+[0-9A-Za-z-]+(?:\\.[0-9A-Za-z-]+)*)?$"
    },
    "description": {
      "type": "string",
      "minLength": 1
    },
    "author": {
      "type": "string",
      "minLength": 1
    },
    "license": {
      "type": "string",
      "minLength": 1
    },
    "tags": {
      "type": "array",
      "items": {
        "type": "string",
        "minLength": 1
      },
      "uniqueItems": true
    },
    "types": {
      "type": "array",
      "minItems": 1,
      "items": {
        "type": "string",
        "enum": ["skill", "mcp", "mixed"]
      },
      "uniqueItems": true
    },
    "minClaudeVersion": {
      "type": ["string", "null"]
    },
    "skills": {
      "type": "array",
      "items": {
        "type": "object",
        "required": ["id", "path", "trigger"],
        "additionalProperties": false,
        "properties": {
          "id": {
            "type": "string",
            "pattern": "^[a-z0-9-]+$"
          },
          "path": {
            "type": "string",
            "minLength": 1
          },
          "trigger": {
            "type": "string",
            "minLength": 1
          }
        }
      }
    },
    "mcpServers": {
      "type": "array",
      "items": {
        "type": "object",
        "required": ["id", "name"],
        "additionalProperties": false,
        "properties": {
          "id": {
            "type": "string",
            "pattern": "^[a-z0-9-]+$",
            "description": "Unikátní identifikátor MCP serveru v rámci pluginu"
          },
          "name": {
            "type": "string",
            "minLength": 1
          },
          "description": {
            "type": "string",
            "minLength": 1
          },
          "transport": {
            "type": "string",
            "enum": ["stdio", "sse", "http"],
            "description": "Způsob komunikace s MCP serverem"
          },
          "config": {
            "type": "string",
            "minLength": 1,
            "description": "Cesta ke konfiguračnímu JSON souboru serveru relativně ke kořeni pluginu (typicky mcp/<id>.json)"
          }
        }
      }
    }
  }
}
