{
  "$schema": "../../schema/plugin.schema.json",
  "id": "example-mcp",
  "name": "Example MCP Server",
  "version": "1.0.0",
  "description": "Ukázkový plugin demonstrující distribuci konfigurace MCP serveru přes marketplace. Obsahuje jeden referenční MCP server.",
  "author": "Fullsys",
  "license": "MIT",
  "tags": ["example", "template", "mcp"],
  "types": ["mcp"],
  "skills": [],
  "mcpServers": [
    {
      "id": "everything",
      "name": "Everything (demo) MCP Server",
      "description": "Referenční testovací MCP server z balíčku @modelcontextprotocol/server-everything. Slouží k ověření, že distribuce MCP konfigurace přes marketplace funguje.",
      "transport": "stdio",
      "config": "mcp/everything.json"
    }
  ]
}
